Timestamp,"I think that I would like to use this
system frequently.","I found the system unnecessarily
complex.",I thought this system was easy to use.,"I think that I would need the support of
a technical person to be able to use
this system.","I found the various functions in this
system were well integrated.","I thought there was too much
inconsistency in this system.","I would imagine that most people
would learn to use this system very
quickly.","I found this system very cumbersome
to use.",I felt very confident using this system.,"I needed to learn a lot of things before I
could get going with this system.",How responsive was the system,How precise was the system,SUS Score
10/06/2025 13:23:52,3,3,4,1,3,3,2,3,3,2,3,2,57.5
17/06/2025 12:07:31,4,1,5,1,5,1,4,2,5,1,6,6,92.5
18/06/2025 18:40:47,3,4,3,3,4,4,2,4,3,3,6,5,42.5
30/06/2025 18:40:09,4,2,4,1,4,2,3,1,4,2,3,4,77.5
30/06/2025 20:14:31,3,4,2,4,2,3,3,4,2,3,5,4,35
18/06/2025 16:31:14,3,2,4,3,4,2,4,2,3,3,2,2,65